{
  "schema": "panel-result/1",
  "persona": "9yo",
  "model": "selftest-robot",
  "artifact_sha": "66da500",
  "query": "?low",
  "throttle": 1,
  "measured": {
    "time_to_move_s": 9.1,
    "time_to_cast_s": 36.1,
    "minutes_played": 0.652,
    "quests_completed": 0,
    "outcome": "playing",
    "turns": 23,
    "console_errors": 1,
    "panics": 0
  },
  "self": {
    "clarity": 5,
    "fun": 5,
    "blockers": [],
    "would_play_again": "maybe",
    "best": "Scripted run.",
    "worst": "Scripted run.",
    "quotes": []
  },
  "stopped_because": "quit"
}
